{"combined_mode_probe":{"roomplan_mesh_ok":true,"roomplan_scene_depth_ok":false,"same_session_depth_after_roomplan_stop_ok":false},"high_resolution_frame_supported":false,"roomplan_supported":true,"scene_depth_supported":true,"scene_reconstruction_supported":true,"schema":"htdt.capture.capabilities","schema_version":"1.0.0","smoothed_scene_depth_supported":false,"world_tracking_supported":true}